{
  "$schema": "http://json-schema.org/draft-07/schema#",
  "$id": "https://makereign.dev/schemas/section.schema.json",
  "title": "MakeReign Marketplace Section",
  "description": "Manifest for a reusable section in the MakeReign marketplace. Every section folder ships one of these. Slimmed in promotion-system-v2 (2026-05-19): curation object + responsive + 4 prose sections were removed in favour of description + tags + preview.png + preview.webm. The slim shape is the load-bearing set for AI section selection (vision model reads the preview directly).",
  "type": "object",
  "additionalProperties": true,
  "required": [
    "id",
    "name",
    "category",
    "version",
    "description",
    "previews",
    "created",
    "updated",
    "submittedBy"
  ],
  "properties": {
    "id": {
      "type": "string",
      "pattern": "^[a-z0-9]+(?:-[a-z0-9]+)*$",
      "description": "Stable, globally unique slug. Lowercase hyphenated. e.g. 'hero-split-bold'."
    },
    "name": {
      "type": "string",
      "minLength": 1,
      "description": "Human display name. e.g. 'Hero — Split Bold'."
    },
    "category": {
      "type": "string",
      "minLength": 1,
      "description": "Marketplace category. Conventional values: hero, intro, carousel, testimonials, gallery, features, forms, cta, footer, navigation, editorial, work, services, contact, process, stats, team."
    },
    "version": {
      "type": "string",
      "pattern": "^\\d+\\.\\d+\\.\\d+(?:-[0-9A-Za-z.-]+)?$",
      "description": "Semver. e.g. '1.0.0', '1.2.0-beta.1'."
    },
    "track": {
      "type": "string",
      "enum": ["stable", "experimental", "legacy"],
      "description": "Optional release track. Defaults to 'stable'. Quality band — orthogonal to lifecycle."
    },
    "lifecycle": {
      "type": "string",
      "enum": ["Submitted", "Approved", "Archived", "Local", "Draft", "InReview", "Promoted", "Deprecated"],
      "description": "Lifecycle position. Three real states (promotion-system-v2, 2026-05-19): Submitted (waiting on a curator), Approved (live in the catalogue), Archived (removed). Legacy values (Local/Draft/InReview/Promoted/Deprecated) stay in the enum so older section.json files still validate; `getLifecycle()` folds them to the 3 real states. `mr submit` sets this to 'Submitted'. Missing → 'Approved' (legacy default)."
    },
    "attribution": {
      "type": "object",
      "additionalProperties": false,
      "description": "Authorship + provenance trail. Populated by `mr submit` at submission time; `promotedAt` set by curator on promotion.",
      "properties": {
        "originalCreator": { "type": "string", "description": "Handle of the designer who first built this section." },
        "originatingProject": { "type": "string", "description": "Slug of the project where the section was first built." },
        "submittedAt": { "type": "string", "format": "date", "description": "ISO date of `mr submit`." },
        "approvedAt": { "type": "string", "format": "date", "description": "ISO date when the curator first approved the section into the catalogue." },
        "promotedAt": { "type": "string", "format": "date", "description": "Legacy alias for `approvedAt` (pre-promotion-v2). Kept for backwards compat with older section.json files." }
      }
    },
    "description": {
      "type": "string",
      "minLength": 20,
      "description": "One-paragraph summary. 1–2 sentences, brand-agnostic, structural. What the section IS, what slots it exposes. Read by both humans and future AI consumers."
    },
    "props": {
      "type": "object",
      "description": "JSON Schema fragment describing the component's props. Freeform; validated only as 'is an object'.",
      "additionalProperties": true
    },
    "dependencies": {
      "type": "array",
      "items": { "type": "string" },
      "description": "Required packages (e.g. 'gsap', 'lenis') the section relies on."
    },
    "motionDensity": {
      "type": "array",
      "uniqueItems": true,
      "items": {
        "type": "string",
        "enum": ["static", "low", "medium", "high", "experience"]
      },
      "description": "Optional motion-density tiers — how much motion shows in the layout. Five tiers ordered low to high: static (nothing animates) · low · medium · high · experience (showpiece). Mirrors GLOSSARY.md."
    },
    "previews": {
      "type": "object",
      "additionalProperties": false,
      "required": ["static"],
      "properties": {
        "static": {
          "type": "string",
          "minLength": 1,
          "description": "URL (preferred — Supabase Storage public URL) or relative path to the static preview image. PNG/JPG/WebP/SVG. Relative paths are legacy and migrated to URLs by strip-legacy-curation.ts."
        },
        "video": {
          "type": "string",
          "minLength": 1,
          "description": "Optional URL to a short video clip showcasing motion. Supabase Storage public URL. WebM or MP4. Designer/curator uploads via drop-zone in the marketplace detail page."
        },
        "live": {
          "type": "boolean",
          "description": "Whether the section supports live iframe preview against a project's design system."
        }
      }
    },
    "tags": {
      "type": "array",
      "items": { "type": "string" },
      "description": "Discovery tags. 3–6 short kebab-case keywords. AI consumers match these against project briefs. Examples: 'hero', 'split-2col', 'image-right', 'headline-led', 'minimal'."
    },
    "created": {
      "type": "string",
      "format": "date",
      "description": "ISO date when the section was first submitted."
    },
    "updated": {
      "type": "string",
      "format": "date",
      "description": "ISO date of the most recent change."
    },
    "submittedBy": {
      "type": "string",
      "minLength": 1,
      "description": "Git handle of the submitter."
    },
    "context": {
      "type": ["string", "null"],
      "description": "Optional brand-context reference. 'acme-2025' floats to latest; 'acme-2025@1.0.0' pins. null/omitted/'_neutral' → neutral default. See decision-section-brand-contexts.md.",
      "pattern": "^(?:_neutral|[a-z0-9]+(?:-[a-z0-9]+)*(?:@\\d+\\.\\d+\\.\\d+(?:-[0-9A-Za-z.-]+)?)?)$"
    }
  }
}
