{
  "id": "hero-split-bold",
  "name": "Hero — Split Bold",
  "category": "hero",
  "version": "0.0.1",
  "track": "experimental",
  "lifecycle": "Archived",
  "description": "Full-bleed hero with bold display headline and supporting paragraph aligned to the left edge.",
  "dependencies": [
    "@/components/section",
    "@/components/section-grid"
  ],
  "motionDensity": [
    "low"
  ],
  "previews": {
    "static": "preview.png"
  },
  "tags": [],
  "created": "2026-05-24",
  "updated": "2026-05-25",
  "submittedBy": "mattthompson",
  "attribution": {
    "originalCreator": "mattthompson",
    "originatingProject": "mr-halden-miller",
    "submittedAt": "2026-05-24"
  },
  "context": "mr-halden-miller"
}
